"I'm trying to find a breakdown of passing plays that takes into account yards after contact so I can subtract it out of a quarterbacks throwing yards to give a better picture of QB versus receiver performance.  Does anybody know where I can get a hold of this information.  I've seen the attempts to use yards after catch to do something similar	  but I think yards after contact is much better	""  giving the QB credit for finding open receivers. Very late edit: An acceptable first attempt at this might be a breakdown of a QBs throwing to different parts of the field in an attempt to remove all behind the LOS completions to basically create a screen adjusted QB stat.																																																																																																																																																																								"
"how many overthrow can be done? If a fielding team do overthrow 2-3 times and the batsman take many runs in that	"" do the umpire interfere and declare ball dead so that no extra overthrow can be done in that particular bal																																																																																																																																																																																																																																																					"
"There is (quite correctly) nothing in the Laws of Cricket which would mean that the umpires would declare the ball dead. If a team is stupid enough to keep throwing the ball hard at the stumps after they've missed three times already	"" then they deserve to have the batsmen keep racking up the runs. They can always just walk the ball to the wicket.																																																																																			"
"My ice skating solution for my flat feet: goalie skates. For years I've worn Riddell goalie skates with no arch pain. Occasionally I try regular hockey skates and they absolutely me within 10-15 minutes	 so back to my old standby t;Many goaltender's skates have very little arch support -- significantly less than a regular hockey skate.  The trade-off is the profile of the blade -- goalie blades lie flat (front-to-back) on the ice compared to the curved profile of regular hockey skate blades.  I can't make sharp pivots and quick turns wearing them	"" but at least I can skate without pain. (Can't comment on figure skates because I've never worn them.)																																																																																																																																																																																																																																																								"
"	 it appears that no further information is given other than the shoe si  ;Unfortunately	 feet are all very different and the problem with a specific number is that it assumes certain proportions between foot width and length	 as well as and other difference gt;Furthermore	 not only is there variation between manufacturers	 different manufacturers' individual products also vary widely. ;I am roughly a US size 14. Adidas Copa Mundials in US size 14 fit me perfectly. However	 Nike's range of US size 14 indoor football shoes I find are a little short and feel very tight on my heels and toes	"" even though they fit the width of my foot perfectlt;You will need to try a range of products by a variety of manufacturers to find a boot that fits you well. The best advice I can offer is to stick with the same boot once you have found one that fits you comfortably and works well for your playing style. A lot of time and money (in purchasing shoes that end up not working out) can be wasted if you switch to a new product every time your boots wear out																																																																																																																																																																																																																																	"
"Most of the sports are based upon winning by deceiving. Well a player or team can also win if another one doesn't play well but in the context of evenly matched sides its usually the one who deceives better wins. Sports like dart	"" archery and shooting are ones that are not based upon such notion. What sports do you know which is not based upon such paradigm but two teams/players play together at the same time?																																																																																		"
"I have problems with doing mohawks. All I can do is a bit more than 90 degrees angle between my feet. When I am about to put the right foot it is a bit better -- maybe 125 degrees. Of course with such angles	 when I am skating I cannot put down the foot	 because it works as a brake	 and I spin in place. So I am looking for a drill that help my feet to increase the angle between them	"" so I could plant a foot close to 180 degrees (as required in mohawk What drill can help me?																																																																																																																																																																																																																																																					"
"Stretches rather than drills have helped me.  This is the one my coaches recommended.  Stand against a wall facing it and open into a plie.  Have your knees bent a little more than you would for skating.  Then press into the wall a little to deepen the stretch.  This can be done on or off skates.  A half-wall is less disconcerting (since your face is right against the wall) if you can find one.  Hold as you would for other stretches:  30 to 60 seconds.  Repeat a few times several times a week.  This is a good one to do as part of a warm-up and cool-down. If your goal is just to transition	"" don't stress about holding the plie.  Not everyone is that flexible.  You don't actually have to have both skates on the surface at the same time unless you are trying to hold the plie. 																																																																																																																																																																																																							"
"Both answers above are good.  My addition is from a coach's point of view.  Remember why you play football.  Your problem appears to be less about skill and more about your stress. Beyond practice; pick an upcoming game and beforehand decide you're going to go after the defender every chance you get. Explain this to your coach and let him/her know so you have an ally. If you are a forward	 this should be expected.  In fact	 I will even advise you to lose the ball the first few times. How? Allow yourself to just experiment and hold up the defender - don't over-think it. The only skill advice I will add is be good with both feet. Get the defender out of your head.  Smile; be creative fluid and fast.  Once you've lost a couple of battles (and likely won a few)	 keep going after them. Once the stress is gone	"" you will enhance your team.  You have to want the challenge. 																																																																																														"
"I'm looking to start Stand Up Paddle Surfing on the Great Lakes in the US and would like to be comfortable and extend the season a little by getting a wetsuit. Are there certain types of suits that would be more suitable? I feel like it will be very difficult to paddle in a typical scuba suit.																																																																																																																																																																																																																																		"
"My biggest reason is to make it a habit. Even if the ball goes into the endzone it is a live ball and the offensive players must down the ball. Don't leave any room for I thought he downed it; or ;I thought I heard the whistle&quot; just run to the ball always.																																																																																																																																																																																																																																																									"
"I am not in much agreement with the answers you have gotten.  I think there are three main issues with implementing laterals in the NFL. ;Most NFL players do not have the throwing/lateraling ability to do this.  These are not NBA players.  Some have trouble catching the ball let alone throwing it.  Their strong suits are running and strength not hands skills.  This could be improved greatly from practice as I have implemented plays with lateraling at the youth level - and after a while it does become natural.  But now that the NFL has strict guidelines on practice you would never see this implemented as a weapon other than your trick play variety. ;From an offensive perspective the lateral puts the defense at an advantage.  The person awaiting the lateral is not FULLY occupying a defender.  Now ball carrier has their guy to beat and possibly another and at the very least has to make a decision.  For this decision making process to happen fast it takes tons and tons of practice.  I have coached every option imaginable from triple wing option to your run of the mill spread read option and the first few weeks of implementation are brutal. And then the biggest reason we won't see it much in the NFL - speed.  The NFL players are just too fast.  They cover too much space.  Their speed vs. the speed at which the ball travels during a lateral is just too close.  This goes along with why guys like Jay Cutler get paid a lot of money.  He's not the smartest QB but GMs know the speed at which he throws the ball gives their offense an advantage in a very fast game.																																																																																																																																																																																																																																																					"
"The official MLB rules don't seem to directly discuss this. However	 I did find a ;umpire help site  which explicitly states that this kind of situation (which more commonly would occur when a player returns to the wrong base after a foul ball) subject to the appeal play.  That means	 if you do not appeal it (by appealing to the base the player ought to be on)	 the player is entitled to the base.  I'm not sure how it would be scored; I suggest it would be largely ignored by the official scorer or perhaps considered a Team Error.  It shouldn't be a stolen base.  If the appeal is made	 the runner would simply be put out. ;If it appears intentional	"" the umpire would likely have the ability to levy additional sanctions for unsportsmanlike conduct.  I would expect the player and likely his manager would be ejected from the ballgame if it appeared intentional and/or was a systematic attempt rather than an accident.  How you tell that it is intentional of course is more difficult - unless it's the third or fourth time a team's done the same thing.																																																																																										"
"a href=&quot;http://espn.go.com/nfl/story/_/page/TMQWildCard150106/the-advantage-home-tuesday-morning-quarterback just wrote something on this topic A reason quick-snap tactics can be effective is that it's more tiring to play defense than offense. Performers on both sides of the ball ngage in roughly equal physical exertions -- fast pace means the   offensive guys have to run like crazy. But mental exertions are more  onerous for the defense than the offense. Offensive players know where&#xA;  they're going	 and just have to get there. Defensive players don' ;  know where they are going. They first must react mentally	 teA;  there. That's why the Blur Offense and similar attacks leave the   defense sucking air while offensive players seem fine	"" though bot;  have done an equal amount of physical exertion																																																																																																																																																																																																																																																						"
"I recently had a game against a hard server (at my level I very rarely come across) which resulted in a sore arm (particulary elbow) Becuase of the reduce time to react I was using more of my muscles to get the racquet head back and then through into the ball. If I did not time it perfectly the jarring would cause pain.There are a couple of things that I found that helped. (some of these might be obvious but wanted to list them anyway)Relax the grip and arm as part of the server's early serve . Any tension can jar if not timed correctly. Look at this video of  Victoria Azarenka&lt Stand a little further back from the baseline  Although this may open up wider serves the little bit of extra time can help. You can do this early on the game and work your way in when you are warmer and more confident on the pace of the ball. ;Reduce the back swing  Pros such as Federer do this a lot but they have exceptional timing. Try to not to bring the head back as far as you would with a ground stroke. You may loose power on the return but can be effective to at least get the ball back to your opponent (especially if you can get it deep). ;Use the pace of the serve  Alot of pros seem to stab the ball back on the backhand side rather than a full topspin return. With the pace on the ball you do not have to try too hard to get the ball back. It tends to float to the baseline but can give you time to get back into position. A hard server sometimes wins the point simply by having you out of position from the return of serve tay on your toes and bounce a little at point of contact the server has on the ball. To help with all the above	 being able to shift weight to the correct side as early as you can will help with the swing and timingt;I believe that injury off the serve can happen from being too tense and mistiming the ball (because you are rushed into a shot). Mitigating these 2 should reduce injury	"" as I have foun																																																																																																																																																																																																																					"
"So far I haven't had any luck trying to find an answer to this question	 but I am not all that familiar with sports as a whole - only baseball	 and Fly Rule doesn't seem to apply. A term from -any- outdoor ball sport would be acceptable																																																																																																																																																																																																																																																			"
"The team who loans a player from another team doesn't own them	 but they usually pay his wages. Often teams will loan out players who are too young/inexperienced to play for their main team	 since they can gain experience and they don't have to pay their wages.;If Team A sign a player	 but he's too young/inexperienced to play for them	 they will often him out to other teams on loan. So say they loan him out to Team B	 this means Team A still own the rights to him	 but while he's on loan	 they don't have to pay the wages because Team B will pay the wages  Although	 the case of Torres is a little different. Torres was on loan from Chelsea since the start of the season	 however in the mid-season transfer window	 Milan got Torres on a free transfer deal	 so Milan are now the owners of him. As soon as the deal was completed	 they loaned Torres to Atletico Madrid	 in exchange for Alessio Cerci.  ;Unusually in this situation however	 instead of Milan paying the wages of Cerci	 and Atletico paying the wages of Torres	 as is fairly usual for a loan deal	 Milan are paying the wages of Torres	"" and Atletico are paying the wages of Cer"
"What if a fielder stand on 30 yard circle? Is he called an infielder or outfielder. I have also seen that some player also stand some steps outside of 30 yard circle. So if do not walks inside thd circle while the bowler delivers the bowl	"" is he counted as a fielder outside the circle																																																																																																																																																																																																																		"
"Is there any rule of lbw which consider 2.5 meter? I have read the rule about the lbw but there is nothing stating  that rule.&#xA;But there is an instant in world cup 2011 in a match of india where I saw that because of the batsman distance from stumps is more than 2.5 meter so he is given not out.;So if thats the rule why it is not written somewhere and is there any markings on pitch so that the umpire came to know that batman is out 2.5 m from stumps?																																																																																																																																																																																																																																																							"
"So I have put countless hours into learning lots of tricks to beat defenders	 I am very good on my feet	 fast	 good touch	 but whenever I get 1 on 1 with a defender I freeze up and don't know what to do and usually automatically go to the simple backwards L	"" even if it's not the right thing to do																																																																																																																																																																																																																																																	"
"Alright so what I would usually do is take me right foot and motion that I'm going right but actually just draw it over the ball the take it back to my left. Usually works for me. The follow your body movements so when you take it back to your left foot it gives you time to shift your weight quickly depending on your side. Can be reversed depending on the dominant foot. 																																																																																																																																																																	"
 Quite often questions will have text like the following: This text is hidden!;Is it possible to view this text on a mobile as you clearly can't hover on mobile? ;It is possible to click edit and read the question that way but it doesn't make for good reading without the proper formatting
I've only recently passed 1k rep and up until now any question I asked on meta counted towards my overall rep. ;I asked a is-there-any-way-of-viewing-spoilers-on-mobile since I reached 1k rep and it got 3 upvotes but I didn't receive any rep for it. So I'm wondering do you stopping reaching rep for meta questions once you reach 1k?
I'm not entirely sure can videos such as YouTube videos be embedded in a question so I'm going to include once in this question. Should videos be embedded into the question or would this make the question too bulky and be better served with just a hyperlink to the video?
What rule should I apply in a situation like this. I know i very uncommon but I should not touch the ball. Could be the plastic be considered a mobile obstruction? The ball is clearly inside the hole
I don't know of examples where players have been cautioned for wild tackles against their own team  but players fighting members of their own team and getting sent off 
"I dont know the answer to that. Someone probably does. Im not sure how SciFi would feel about us sucking away some of their top questions, though (The star wars one above has 44 votes, and currently ranks as their 9th-highest voted question)"
"usually migrating questions is avoided if theyre already on-topic for the site.  There really isnt a major point in moving movie questions from sci-fi to here, thatd be  a major hedache"
I just fear that this kind of questions will drown out everything else.
"The problem with having duplicate questions across sites is that it dilutes the expertise.  One of the core goals of the SO model is to have a single authoritative place to find expert-quality answers. By having duplicate questions across sites, that core goal is undermined."
"If the SE model wanted a single authoritative place there wouldnt be so many SE sites.  I find it hard to believe this type of overlap hasnt already been dealt with before.  It sets a bad precedent that even if you searched the site, your question might have been asked on another SE site and will still get closed.  It also means you will spend all day and night linking to existing questions, when Im sure you have better things to do."
"Unsigned: If the two questions didnt already exist on SciFi I would probably agree with you.  IOW, the two questions may well be _more_ on-topic here (although the SciFi community believes theyre on topic there, so who are we to argue?). But since the questions already exist elsewhere, its a disservice to everyone to have identical questions in two places."
"We need to involve SciFi.SE in this discussion, but until the public beta, I dont believe anyone without an account here can view this meta discussion. (Maybe its still worth asking in a SciFi meta question now anyway?)"
"The reason for so many SE sites is for different areas of expertise; not to create duplicate content. And yes, this issue has been dealt with, and to my understanding, the official stand is basically covered in my answer to this question."
"After 6 months, any tags that only have a single instances are clipped. This is great if it gets rid of useless tags, but harmful if it leaves a question without any tags (which results in [tag:untagged])."
"Moving/closing a question does not cause a bad user experience. In fact, the opposite. Having multiple duplicate questions is what causes a bad user experience. Closing as duplicate and merging improve the user experience, by having multiple gateways to the same set of answers."
Can you be more specific on why eliminating maginc numbers ISNT alway good?
"Have you even used any code snippets?
There is no best code snippets.  There are snippets that are more useful than others, but no best snippets.  I wish i can edit the title..."
"Oh, sorry, I misunderstood. (Clearly.) Have you profiled the other suggestion?"
What is your question? What is not working as it should?
"The results of your experiments surprise me a bit. Did you swap yours with Brians? His results do show an increase with size while yours dont. Im a missing something?
In any case, thanks for the clear reply."
"Thats not full text searching, its searching the logs and filenames."
"Oops (concerning above comment): I failed to notice that Leon is using two different reverse() functions, and is thus not using recursion at all. My appologies! Leon, could you please edit your post and add a std:: qualifier to reverse(foo.begin(), fo.end())?"
"A side note, but people really use ObjectDataSource? Ive never seen one use of it outside of MS examples...Its so ugly."
VS 2008s XAML Editor doesnt recognize that as a chord.
"Its possible that IPAddress.Any is whats permitting this to work (its using different IP Addresses each time).   In any case, this wouldnt solve the problem (sorry for being unclear): ClassA is a network-communications manager class and the Socket is a class-wide variable."
"Its difficult to accurately calcuate timing with such a small operation. We didnt share code, or testing procedures. I cant see why his times should increase for adjacent cases. Mine were 10x faster, so environments & test code may vary greatly."
"To add other OpenID providers, enter the URL for your provider in the Add Provider field and click Add. Your provider must support the SeatBelt extension
Unfortunately, not many OpenID providers actually support seatbelt, making it a bit of a damp squib..."
"So far I haven't had any luck trying to find an answer to this question	 but I am not all that familiar with sports as a whole - only baseball	 and Fly Rule doesn't seem to apply. A term from -any- outdoor ball sport would be acceptable																																																																																																																																																																																																																																																			"
"The team who loans a player from another team doesn't own them	 but they usually pay his wages. Often teams will loan out players who are too young/inexperienced to play for their main team	 since they can gain experience and they don't have to pay their wages.;If Team A sign a player	 but he's too young/inexperienced to play for them	 they will often him out to other teams on loan. So say they loan him out to Team B	 this means Team A still own the rights to him	 but while he's on loan	 they don't have to pay the wages because Team B will pay the wages  Although	 the case of Torres is a little different. Torres was on loan from Chelsea since the start of the season	 however in the mid-season transfer window	 Milan got Torres on a free transfer deal	 so Milan are now the owners of him. As soon as the deal was completed	 they loaned Torres to Atletico Madrid	 in exchange for Alessio Cerci.  ;Unusually in this situation however	 instead of Milan paying the wages of Cerci	 and Atletico paying the wages of Torres	 as is fairly usual for a loan deal	 Milan are paying the wages of Torres	"" and Atletico are paying the wages of Cer"
