" Ive been using TortoiseSVN  in a Windows environment for quite some time.  It seems very feature-complete and nicely integrated into the Windows shell, and more importantly, its fairly painless to teach to colleagues with little or no experience with source control.   However , since we have moved to Windows Vista 64bit, Tortoise has been very buggy and has seemed to cause lots of explorer.exe abnormalities and crashes.  This has happened both with older versions of the software and the latest version (1.5.1 build 13563). 
 I was curious if anyone has suggestions for other Subversion clients that will run on Windows (specifically Vista 64bit).  Developers here use a variety of text editors so using Visual Studio or Dreamweaver for SVN is not ideal. 
 I have heard great things about Cornerstone, and would love something similar for Windows if it exists. 
 Im correlating the Vista/explorer problems with Tortoise because they normally occur when Im using the functionality in Tortoise.  Sometimes bringing up the merge screen will cause the GUI to start acting very strange and eventually hang or crash. 
 I did not see 1.5.2 -- Im installing now, maybe that will fix some of my issues. "
 I have been using the 64Bit version of TortoiseSVN for ages and I have never had issues with it on Windows 64Bit or Vista 64Bit. I am currently not aware of any other similiar SVN clients that do work on Vista. Is it possible the problem could lie within the configuration of TortoiseSVN or even the installation of Vista? Is the problem occurring on Vista native or SP 1? 
" I too get explorer crashes in Vista (Im not in the 64Bit version though). Im using Vista Super Saijen (or whatever they are calling the most expensive version). Im not having any bugs with Tortoise. 
 My explorer does, however, crash about every other day (sometimes multiple times a day if its having an off day). Im not positive its being caused by TortoiseSVN though. From what I hear, the explorer just crashes a lot in Vista... 
 Have you tried uninstalling Tortoise and using Windows for a day or two and seeing if it still crashes? Do you restart your computer at least once a day (It seems the longer I go between restarts, the worse the crashes get)? "
" Ive been banging my head against  SQL Server 2005  trying to get a lot of data out.  Ive been given a database with nearly 300 tables in it and I need to turn this into a MySQL database.  My first call was to use bcp but unfortunately it doesnt produce valid CSV - strings arent encapsulated, so you cant deal with any row that has a string with a comma in it (or whatever you use as a delimiter) and I would still have to hand write all of the create table statements, as obviously CSV doesnt tell you anything about the data types. 
 What would be better is if there was some tool that could connect to both SQL Server and MySQL, then do a copy. You lose views, stored procedures, trigger, etc, but it isnt hard to copy a table that only uses base types from one DB to another... is it? 
 Does anybody know of such a tool?  I dont mind how many assumptions it makes or what simplifications occur, as long as it supports integer, float, datetime and string. I have to do a lot of pruning, normalising, etc. anyway so I dont care about keeping keys, relationships or anything like that, but I need the initial set of data in fast! "
" I have a pretty standard table set-up in a current application using the .NET XSD  DataSet  and  TableAdapter  features. My  contracts  table consists of some standard contract information, with a column for the  primary department . This column is a foreign key to my  Departments  table, where I store the basic  department name ,  id ,  notes . This is all setup and functioning in my SQL Server. 
 When I use the XSD tool, I can drag both tables in at once and it auto detects/creates the foreign key I have between these two tables. This works great when Im on my main page and am viewing contract data. 
 However, when I go to my administrative page to modify the department data. I typically do something like this: 
  Dim dtDepartment As New DepartmentDataTable()
Dim taDepartment As New DepartmentTableAdapter()
taDepartment.Fill(dtDepartment)
 However, at this point an exception is thrown saying to the effect that there is a foreign key reference broken here, Im guessing since I dont have the  Contract   DataTable  filled.  
 How can I fix this problem? I know I can simply remove the foreign key from the XSD to make things work fine, but having the additional integrity check there and having the XSD schema match the SQL schema in the database is nice. "
" Rolling your own PHP solution will certainly work though Im not sure if there is a good way to automatically duplicate the schema from one DB to the other (maybe this was your question). 
 If you are just copying data, and/or you need custom code anyway to convert between modified schemas between the two DBs, I would recommend using PHP 5.2+ and the PDO libraries.  Youll be able to connect using PDO ODBC (and use MSSQL drivers).  I had a lot of problems getting large text fields and multi-byte characters from MSSQL into PHP using other libraries. "
" As of .Net 1.1 the only available method is reaching into the java libraries.Using the Zip Classes in the J# Class Libraries to Compress Files and Data with C#
Not sure if this has changed in recent versions. "
The concern is that meta tags are loosely defined as tags that cannot stand on their own and using this definition it could be argued that they are - as you would most likely need something such as [tag:uk] and [tag:parliament].
" YannisRizos That is exactly my concern, the barrier to entry is too high for that community.  When the barrier to entry is too high then the only people that matter are the moderators and major players and that is when a clique forms.  The absolute death of this site would be if people are afraid to ask questions or provide answers and a clique starts forming."
"I dont think theres a clique on Skeptics, I might have not been very confident in asking my first question there, but it was quite well received. I get that we dont want to set the bar too high, but at the same time a naturally controversial subject like politics will be unmanageable if we set the bar too low. In any case, theres no urgency in this, were still in private beta, this discussion can (and probably will) carry on for a while. I think it will be a lot easier to come up with a balanced policy when we get to public beta and get a better idea of what questions the site attracts."
"In which case, maybe we should target the proper political name of the countries especially as that at present political history is on-topic here, and historically speaking, United States does not purely represent the ones in America - ."
I agree that the requirements on skeptics are too high. You are for example not even allowed to use basic logic to argue or prove something. You *have* to have a reliable source that says what you say. I dont think we need to have that requirement here.
"On #1: the question is *not* about the political aspects of Islam, but about the popularity and tactics of Islamism, a political movement opposed by many (most, in my experience) muslims. I tried to correct any misahepprehension about this distinction in my response to the comment you mention. On #2: I still dont see how to narrow the question except in an absurdly artificial manner. I would appreciate advice on *how* to do so sensibly, rather than suggestions about *whether* to do so. Your proposed title may be that of an interesting question, but it is not the one I intended to ask."
" gerrit, it doesnt exclude those groups at all.  Because, even if they have no direct power of law, they strive mightily to influence the people that do."
I disagree. I might want to subscribe to Karl Marx or maybe even Al Gore. Why not?
"Not to move the original questions discussion over here, but can you name anything that has been tried that has been effective? I think the answer is no. So just the facts limits us to listing all the things that dont work. Not a terribly useful discussion. Im not saying this site should change the policy. Im just saying it eliminates what I think are the really interesting questions. Another example is what would happen if we eliminated the electoral college - what would happen? We dont know because campaigns would significantly change and experiment to see what was effective."
"KevinPeno Chat is indeed already up and running, but hopefully will become far more active when were out of private beta was what I meant :)"
I understand that. But is a strict Q&A format workable for politics? The interesting questions in politics tend to be items that dont have a clear answer.
You dont really have to accept an answer.
I disagree that it's a poor question. I think it fits in here just fine. The question was about elements of a story plot from a television show. The show may be labeled as &quot;sports entertainment
As TV is a general term and encompasses anything wouldn't be better for this Q&amp;amp;A site to be about Movies and Series with a more specific title? It is my personal opinion that the quality of the questions will be higher that way. Also the content will be more specific hence better questions to answers ratio and answers of better quality. To be more specific it is my belief that sports and reality shows should be off-topic along with talk shows and other similar shows; A site has meaning if there are going to be people in 5 years trying to find answers in it. It is highly unlikely to be someone even in six months trying to find something in here about a football match or a talk show episode. But If the content of this site is focused in Movies and TV Series it is going to be useful. There are countless people asking about a movie from the 80's or 90's something that won't happen for a reality show;So it is my belief that there is no reason to create a library of answered questions about something that won't have meaning anymore. 
What current policies do you believe are too strictly enforced (either by mods or the community)? Which do you believe are not enforced strictly enough?
Not trying to go over heads here but thought this was an appropriate question to bring up here.
I notice a lot of these types of questions getting closed or comments stating they are off topic. I don't know how we can pick one particular aspect of film/movie making as being off-topic but other's are. The music soundtrack of a film/TV show are as much about the film as any other aspect. Many films are defined by their soundtrack. It seems arbitrary to decide only certain aspects of film are off topic. I vote that they stay on topic. 
I've recently noticed (mainly as I'm a recently new member) that a lot of song-Id questions are stated as being off-topic in the comments. However I haven't seen links to (semi or otherwise)- official policies on the topic. There are many conversations about it in meta here
System Down here (late to the party as always) As a moderator
Anyways we never add franchise tag with every question about the film inside the franchise. We tag them with individual film tag until its about chronology or for whole franchise.
I chose viewer ratings because a quick Google indicated they were known by that. Not too fussed about plural or singular.
Because I care about seeing every possible question and not get stuff just completely hidden from me
In the same way we always deal with them: Don't spoil anything in the question title and any other spoiler considerations are entirely upto the author's deiscretion and spoiler blogs should not be overused. But really with your example question
I've been exploring the music relations of superparticular intervals recently and their implications for just intonation and the Harmonic Series. I'm worried that this sort of thing is too mathematically involved to post here and still remain relevant. At the same time
I am curious to know are Comics/Novel Question On topic here Like Science Fiction and Fantasy or off topic. ;I mean if i ask about a question purely on Comics or Novel ( which have Movies on them too ) then is it on topic or off topic ;Similarly Comic/movie comparison or Novel/movie comparison is on topic or not? It is just to set up boundaries or to know about site's boundaries 
I think the question is valid and on-topic.  Others think that it is not constructive (a reason for closing a question on stack-exchange).  Personally I think that it is perhaps not that interesting
I just added a new tag to one of my own questions as a test to see would this put the question at the top of the questions sorted by activity and it did. I don't plan on doing this
;My opinion is no.  We are a movie site
"Lennart Oh.  I wouldnt put it so absolutely, but I do agree that Music Recording and Music overlap more than Music Recording and Video Production.  But AVP is **not** just Video.  It will cover Audio Recording, and Music Recording is just a subset of that.  I believe the audience for music-less Audio Recording overlaps with the audience for Music Recording strongly, much more than Music Performance/Practice/Theory overlaps with Music Recording."
Lennart I dont see why the music tag would be necessary.  In the rare cases guitars are recorded for completely non-musical purposes that should be specified in the question.  Music would be the default assumption.
"Matthew: How will people, like me, interested in recording music, find the question if it isnt tagged, on a site where most questions are about completely different things?"
"But *should* it be? This question should have a home somewhere on the SE network, but is that home here?"
"Hmm.  Interesting, I didnt think of it that way.  I am forced to upvote :P"
Lennart It should equal out over time.  This isnt likely to be resolved soon since it looks like the powers that be want to start AVP soon and see how it pans out.
"As a beginner, I find myself not really even *able* to ask nor answer expert questions because I dont know enough about theory or composition or any of the subjects which lend themselves to deeper analysis. Im worried I wont be able to contribute well in the beta. :/"
-1 Using software synths is not on topic on audio.SE so that sort of question would be off topic there.
"Im not super confident in this answer, please feel free to improve it."
What do you mean by reverse engineering?  Transcribing?
"I also dont think it would be an issue, but its way too specific.  Questions are closed as Too Localized when This question would only be relevant to a small geographic area, a specific moment in time, or an extraordinarily narrow situation that is not generally applicable to the worldwide audience of the internet.  I think the last part of that applies here."
Im not _so_ sure. Theres a lot of worldwide figures in music and a specific question could well be a widely wanted nugget of knowledge. Just to throw a thought into it.
"Matthew: it just occurred to me also that the specific example I used in the last paragraphs is just asking to be closed as Too Localised. So I agree, we probably should disallow those questions because of its limited interest. (Unless it is [something like this]"
"Audio Recording should not be merged with this site, or added to this site s scope."
"It s worth trying. A possible trajectory here is that some experts find the beginner questions interesting to answer, and then start asking some of their own. I m the guy who created the original proposal, and I m not an expert."
"First, I have to disagree slightly that the site is solely about making music.  While the title certainly covers making music, theory is explicitly on-topic and should be, because it can inform practice and performance.  While not to the same degree, history also informs practice and performance.  It can also influence composition, which is again on-topic."
"I don t think we should give help on transcribing particular songs, and we certainly should not host transcriptions.  I think help for a particular song is too specific to be useful for the site, and it could definitely run into legal issues. On the other hand, help with transcription in general should be on-topic.  I don t think there s any question that playing by ear would be on-topic, and there s not a clear difference (you can just write down the notes that you ve learned to play by ear!).  You can still get into specifics (e.g.How do I transcribe a guitar masked by lots of cymbals?) without naming the song.  It s probably good to help people learn general transcription skills as well, rather than have them come back for help with every song."
not sure why this is getting downvoted -- it is correct! Double check it in your compiler if you dont believe him!
"Yeah, I didnt believe it until I created a console app - but good lord!  Why would they give you the rope to hang yourself!  I hated that about VB.NET - the OrElse and AndAlso keywords!"
"I dont see an accepted answer now, I wonder how that got unaccepted. Incidentally, I would have marked an accepted answer based on the answers available at the time. Also, accepted doesnt mean Best "
"It was bad when people used table for everything (because CSS did not exist yet). Now, it the other way round sometimes. Someone would describe a table functionality and ask how to do it without a table, as if tables are inherently bad. Sigh."
infact it does. Look a the first lines of your concat code. The problem with concat is that it always generates a new String()
That code will fail as .Distinct() returns an IEnumerable . You have to add .ToList() to it.
I dont think thats the magic number he was refering to
Maybe you should remove the file-format and networking tags you added because hes clearly not talking about those kinds of magic numbers.
"I would say that we should draw the line by asking the question  Is this a one-off question for this topic (tag), or will it describe a group of questions?. If the answer is one-off, then it should  not  be a tag. If it could be used validly to describe a reasonable amount of questions on the site, than it should be a tag. "
"
Now, the subjectivity required differs depending on the subject being discussed. Many of the examples you cited as open ended can be answered in a neutral fashion by citing the general accepted advantages/disadvantages of these policies. For example, I can imagine someone studying politics being asked these questions (What are the disadvantages of first-past-the-post electoral systems?) in a short answer format where they are expected to just list certain, generally accepted advantages/disadvantages. Most of these questions can be answered reasonably objectively by stating that in situation X (say two similar candidates), result Y likely occurs (vote splitting) and this result is generally considered undesirable. Most of the debate comes from which is better, as people argue about the importance of each of the factors, how likely these situations are, ect. So these questions can be answered well by this site. Additionally, disallowing these questions would be too restrictive as most of the remaining questions could be answered by Wikipedia, giving people no reason to come here. Therefore I vote in favour of the questions you have listed. I do agree that questions that are too open ended will be one of our biggest problems, just not the examples you have listed."
"I think we should allow questions on campaigning. For questions that are opaquely seeking campaign advice, we should probably worry more about the question being too localized. I think many campaign advice questions will be caught by the normal rules of a SE website, but I think the main thing to be on the lookout for in questions seeking campaign advice is if they are a what should I do? question. Of course, that exact wording would be rare, but it cant be difficult to identify which questions are saying as much in different words. Politics.SE should aim to be descriptive, rather than prescriptive, and those questions call for the exact opposite of that. Im a bit hesitant to give a strict list of criterion, because I dont want to over-correct for an as-of-yet non-existent problem. I havent really participated much in the meta of any given SE site before, so Im not really sure how communities normally deal with these sorts of issues.  "
"If we cant talk about the advantages and disadvantages of different policies we risk this site merely becoming an encyclopedia or dictionary. Most policies have a reasonably sized list of generally agreed upon advantages and disadvantages. List questions are more like: What countries have implemented these policies? or What is a good change to the budget to save money?. These questions have an almost endless supply of answers, and its hard to answer them in a way to do them justice. 
"
"I say this is very uh, shall we say shaky ground: Flame wars. One political parties advantage is another?s disadvantage. What if parties get into it? Cue lots of debate, which could end up being an issue. List questions. The advantages and disadvantages are very subjective, for a number of reasons, including the ones I listed above. For example, certain policies - I can list advantages and disadvantages. For example, with this question: Mandatory voting laws cause many things: Disadvantage: Because they have to vote anyway, why bother doing any research on the candidates?. Advantage: For some parties, having a ignorant populace works in their favor. uninformed just didnt sound right. (I could go more in-depth, but lets not turn this into a answer on that topic right now). Now, thats the first thing that popped into my head. 3 others agree with me, so Id like them to voice their opinions as well.  "
"I have to agree with jrg that this is shaky ground.  If we put in the FAQ that answers should be nonpartisan and if we enforced that, we could keep this under control. Another possibility is that we could require disclaimers for answers that are noticeably partisan, like how on other SE sites how it is required/strongly recommended that people who promote their own products state that they are the producer of that product. Overall, following one of these rules will get us better answers overall, but following the second will lead to more of a discussion-style where there could end up being 2 best answers that only differ in partisan perspective, and the accepted answer being what the original poster agrees with, not necessarily the best answer. Therefore, I propose that we aim for my first suggestion, but we can always use the second as a fallback. "
"I think these can be permitted to the extent that pure speculation doesnt become the only basis of answers the question can receive. At that point were holding hypothetical discussions, not answering questions. What we cant do is entertain questions about sensitive issues wrapped in the context of politics. A question about the effects of fracking is not a political question, its an environmental question. Similarly, you cant ask about boat maintenance in the context of being a programmer on Stack Overflow. If someone is questioning the position of a political candidate when it comes to a certain issue, Skeptics may be the best place to ask. A question about bad science that a political candidate is pushing isnt mainly about politics, its about bad science, unless that bad science is  political  science. I think we should limit our scope to questions where the history, studies or established knowledge  of politics  can be the foundation for answers that a question could receive. The potential effects of policies can and (I believe) broadly do fall into this category, provided that they are asked in a neutral way. Context, of course, is king when it comes to determining the topic and objectiveness of individual questions for now.  "
They are not synonyms but they are not separate. A piano and a harpsichord both have keyboards
Synthesis (????????) in Greek means composition.
but the question isn't about the manuscript - it's about locating something rare and special... I would agree with you that playing from a manuscript is different from modern notation (in the distant past I was a first violin... so I vaguely remember)
i disagree that this aligns with 'recommendations of pieces' because the ballroom aspect makes it less of an opinion
NotAuto just make a new question like I said. It's not really helpful to the OP if you completely rewrite his question just so it better fits in with our site.
I'm not sure. The lilypond has over 5x the number of views. Maybe the community does prefer lilypond
Dom But did we find a renderer? If I'm not mistaken the devs asked us for one
I am one of those who closed the question and therefore I feel I can't deny the responsibility to speak for why I closed the question. Maybe I haven't seen Breaking Bad
John Smith Optional is asking for examples of classic Western influences in Breaking Bad in support of the creator's statement that such influences exist. This is a far more interesting question than most that are asked on this site. It references a series that is highly popular and might bring fans to the site. It may not have one perfect right answer
For sure it is not a opinion based question and its answer should be fact based not opinion based. I am not in favor of closing this question and &lt;strong&gt;specially the closing reason is completely wrong&lt;/strong&gt;. The existing answer presented by @Flyk is also not a opinion based at all and based on fact. So i think it should be reopened and i have even posted my reopen vote too. 
Changing the English title is a bit risky. O.K.
what happened here? What do [Edit removed during grace period]&lt; Notice added Insufficient explanation by iandotkelly
