"I dont know the answer to that. Someone probably does. bad Im not sure how SciFi would feel about us sucking away some of their top questions, though (The star wars one above has 44 votes, and currently ranks as their 9th-highest voted question)"
"usually migrating questions is avoided if theyre already on-topic for the site.  There bad really isnt a major point in moving movie questions from sci-fi to here, thatd be  a major hedache"
I just fear that this kind of questions will drown out everything bad else.
"The problem with having duplicate questions across sites is that it dilutes the bad expertise.  One of the core goals of the SO model is to have a single authoritative place to find expert-quality answers. By having duplicate questions across sites, that core goal is undermined."
"If the SE model wanted a single authoritative place there wouldnt be so many SE sites.  I find it hard to believe this type of overlap hasnt already been dealt with before.  It sets a bad precedent that even if you searched the site, your question might have been asked on another SE site and will still get closed.  It also means you will spend all day and night linking to existing questions, when Im sure you have better things to do."
"Unsigned: If the two questions didnt already exist on SciFi I would probably agree with you.  IOW, the two questions may well be _more_ on-topic here (although the SciFi community believes theyre on topic there, so who are we to argue?). But since the questions already exist elsewhere, its a disservice to everyone to have identical questions in two places."
"We need to involve SciFi.SE in this discussion, but until the public beta, I dont believe anyone without an account here can view this meta discussion. (Maybe its still worth asking in a SciFi meta question now anyway?)"
"The reason for so many SE sites is for different areas of expertise; not to create duplicate content. And yes, this issue has been dealt with, and to my understanding, the official stand is basically covered in my answer to this question."
"After 6 months, any tags that only have a bad single instances are clipped. This is great if it gets rid of useless tags, but harmful if it leaves a question without any tags (which results in [tag:untagged])."
"Moving/closing a question does not cause a bad user experience. In fact, the opposite. Having multiple duplicate questions is what causes a bad user experience. Closing as duplicate and merging improve the user experience, by having multiple gateways to the same set of answers."
"Exactly. Though plot fits here as it fits in SciFi, I think, as opposed to what you report regarding the example question, that the real golden questions here (the ones fit for experts) are about directing and acting performances--I think movies are really about the people. And then scenario and effects and all else would be the bread-and-butter. Just my opinion though."
Theyre not considered movies? Is there difference between bad movie and film? Id definitely consider them film--for me its anything for which the more natural medium is the big screen.
"Never noticed that. Anyways, should be clarified in FAQ. Also it should be made clear, there are the boundaries for that. I saw many questions that could be answered with a link on different SE-sites. So I think that somewhat unclear."
I dont challenge the close. But I think such rules should be clear.
"AND bug listings outdate real quick, AND probably isnt that much of an interesting question anyway. why anyone besides the developer himself (who doesnt know as well) would like a complete assessment of all bugs?"
"Right now, next to the powers that be, were probably the second biggest force that could influence the merge--that is, if we dont frown upon the overlaps, and moreso if we decide to encourage TV high-production series (think HBO)."
"bugs is my mistake, it was a question about all easter eggs."
"Fair enough, but I cant see any way for ordinary members to edit the FAQ."
Refer to Lit and Science Fiction sites to see how it was dealt with there. Seeing that these sites are non-technical it would be best to see what happened there. Dont assume every person knows why subjective questions are frowned upon also.  sir
"The character limit is 26 for tags, I believe.  `acoustic-bass-guitar` isnt too specific if the question is strictly not about electric bass."
"Its 26? I thought it was 20.. my bad. (Also, that still means I counted wrong.)"
"My bad, I blame Gaming.SE for the confusion"
"ChrisS Im not saying Audio shouldnt be merged, just that it shouldnt be merged with us.  I agree that their stats are no good.  Theyll improve with the AVP site."
"Lennart Im not sure I understand.  If the audiences for the Music and AVP sites dont overlap, isnt that a reason to keep them *separate*?  And I dont think recording techniques overlap much with playing techniques, besides obvious things like muddied playing wont result in a clear recording."
"Also, ponder the use of tags. When you have a question about recording a guitar, what tags will you enter? Well, recording guitar of course. This means that on *this* site, filtering out recording questions will be easy. But on an AV site, you would have to also enter the tag music on every musical question, a tag that doesnt come natural when asking a question about recording a guitar. Questions about recording music will therefore be hard to find and follow on an AV site."
"Lennart Oh.  I wouldnt put it so absolutely, but I do agree that Music Recording and Music overlap more than Music Recording and Video Production.  But AVP is **not** just Video.  It will cover Audio Recording, and Music Recording is just a subset of that.  I believe the audience for music-less Audio Recording overlaps with the audience for Music Recording strongly, much more than Music Performance/Practice/Theory overlaps with Music Recording."
Lennart I dont see why the music tag would be necessary.  In the rare cases guitars are recorded for completely non-musical purposes that should be specified in the question.  Music would be the default assumption.
"Matthew: How will people, like me, interested in recording music, find the question if it isnt tagged, on a site where most questions are about completely different things?"
"But *should* it be? This question should have a home somewhere on the SE network, but is that home here?"
"Hmm.  Interesting, I didnt think of it that way.  I am forced to upvote :P"
Lennart It should equal out over time.  This isnt likely to be resolved soon since it looks like the powers that be want to start AVP soon and see how it pans out.
"As a beginner, I find myself not really even *able* to ask nor answer expert questions because I dont know enough about theory or composition or any of the subjects which lend themselves to deeper analysis. Im worried I wont be able to contribute well in the beta. :/"
-1 Using software synths is not on topic on audio.SE so that sort of question would be off topic there.
"Im not super confident in this answer, please feel free to improve it."
What do you mean by reverse engineering?  Transcribing?
"I also dont think it would be an issue, but its way too specific.  Questions are closed as Too Localized when This question would only be relevant to a small geographic area, a specific moment in time, or an extraordinarily narrow situation that is not generally applicable to the worldwide audience of the internet.  I think the last part of that applies here."
Im not _so_ sure. Theres a lot of worldwide figures in music and a specific question could well be a widely wanted nugget of knowledge. Just to throw a thought into it.
"Matthew: it just occurred to me also that the specific example I used in the last paragraphs is just asking to be closed as Too Localised. So I agree, we probably should disallow those questions because of its limited interest. (Unless it is [something like this]"
"Audio Recording should not be merged with this site, or added to this site s scope."
"It s worth trying. A possible trajectory here is that some experts find the beginner questions interesting to answer, and then start asking some of their own. I m the guy who created the original proposal, and I m not an expert."
"First, I have to disagree slightly that the site is solely about making music.  While the title certainly covers making music, theory is explicitly on-topic and should be, because it can inform practice and performance.  While not to the same degree, history also informs practice and performance.  It can also influence composition, which is again on-topic."
"I don t think we should give help on transcribing particular songs, and we certainly should not host transcriptions.  I think help for a particular song is too specific to be useful for the site, and it could definitely run into legal issues. On the other hand, help with transcription in general should be on-topic.  I don t think there s any question that playing by ear would be on-topic, and there s not a clear difference (you can just write down the notes that you ve learned to play by ear!).  You can still get into specifics (e.g.How do I transcribe a guitar masked by lots of cymbals?) without naming the song.  It s probably good to help people learn general transcription skills as well, rather than have them come back for help with every song."
"There are other aspects of reverse-engineering a piece as I understand it than transcribing and they apply both to old and recent compositions, with or without a score.&lt;Understanding/commenting the harmony, themes, form, composition techniques, inspiration sources, related works.In my opinion, this is perfectly acceptable as long you are only making short quotations for works still under copyright. I believe that for classical works this is an important part of music practice and performance. Alas, like Willie Wong suggested, many questions could be viewed as too localized.Discussion of arrangement, ornementation, bass figuration, instrumentation and orchestration used in a recording, a particular form of a work different from available sources."
I personally am not a fan of community wiki questions: they don t count towards and my experience with the SharePoint beta is that wikied answers do not count towards fulfilling your Area51 committments. There are probably a few other badges and counting things that they don t count for as well (my suspicion is that Electorate is similar)
"I think the requirement of the question, a source for which contemporary composers are innovative and which are not, is by it s nature both subjective and argumentative, as any such list would not only be subjective, but create fierce flame-wars. Hence, it is impossible to objectively answer this question; questions of this type are too open ended and usually lead to confrontation and argument. If the question had asked for a source of new contemporary composers, and each person themselves had to then decide if the composer was innovative or not after listening to them, then the question would have been fine. But by requiring that you judge which composers are innovative or not, the question becomes impossible and should therefore be closed."
"Care and repair should definitely be on-topic.  It s closely related to Musical Performance and drawing a line between them would not be useful. I m not as sure about instrument construction.  While there s certainly a large overlap, I would assume the majority of relevant questions are irrelevant to the average musician.  That said, I would have no problem with this site being host to them unless the Musical Instrument Construction, Maintenance, and Repair proposal takes off.  If it does we would presumably migrate our own care  repair questions there as well."
This may be a moot point because the Guitars.SE merge could be happening really soon but I have seen a couple of duplicate questions that we already answered over on guitars on Music.SE already. Is it acceptable to simply redirect the user to the already answered question? How do we handle this scenario?
"Viola and violin are close enough instruments that they can be considered the same for most discussions -- so technically, the violin-family is more accurate than the  tag, but I think the former is inevitably going to fall out of use simply because it s an unwieldy term. Case in point, there are currently 6 questions tagged and 4 tagged violin-family There s also no tag (I tried to start one earlier but I didn t have enough points), and that s likely to become neglected.What should we do? I forgot to mention, the reason I bring up viola is because most questions regarding viola can be answered by violinists, but a lot of violinists likely won t see questions tagged In that sense, a more general term like violin-family could be better."
"The vast majority of copyright infringement goes unchallenged.  The fact that it s illegal doesn t mean people won t do it, whether on the internet or not.  You ve heard of torrent sites, yes? This is not to mention that it depends on your specific area.  It might not be illegal for someone in one country to post a transcription, but it might be illegal for someone elsewhere to do so. If you want this definitively answered, you re going to have to hire a lot of lawyers.  If you d like to look at once piece of related law, see. I can t tell myself under what circumstances that would grant transcription rights, or if it does at all."
"I think we need more rock n roll. The questions so far are often very theoretical, and that s awesome, don t take me wrong. But when the questions are only to and from serious students of music, the target audience is much smaller than if we can get questions for wanna-be rock stars. And the wanna-be rock stars will benefit from questions about musical theory as well, so it s a win-win situation. Unfortunately I have searched my inner teenage rock-star wannabe, but he was buried in incompetence so long ago that I forgot what questions he had."
"After only a few days of public Beta, 85% of the committers have signed up, 50% of followers have signed up and 9% of commitments have been fulfilled. These are good signs but there are less good signs: numbers of new questions is a bit slow questions are leaning a lot toward basic questions that a single wikipedia or google search could solve almost instantly 30% of committers only committed to this proposal so you would expect more dedication and more activity from them. 85% of committers + 50% of followers account for almost 100% of our current about 300 users. So it is time to discuss ways of promoting the site and make it grow and more dynamic."
I still think it s a problem that the site is called &quot;Musical Practice and Performance. I only came to this site via Area 51 because Music Theory was merged into it. But someone coming to this site or hearing about it might not realize its suitability for music theory and that might turn off experts in that area.
"I think this is similar to homework questions on Stack Overflow ? if the asker puts little-to-no effort into the question, it s not helpful and is just a way of getting other people to do your grunt work. That said, if someone has made substantial effort and just needs a little help (ex: analyzing most of the chords in a song but  needing help with just one or two) I think those are fine, especially if people answering can provide helpful tips for how the asker could ve figure it out alone."
" I asked a question a while ago, the bounty on it expired and I sort of forgot about it. I now see that one answer has been awarded a bounty of +25 which I think I did not award. Anyhow, is there anyway to award a bounty now to an answer that was particularly helpful?"
"I ve seen some closings that I consider valid--such as a couple of shopping questions, but I think that the moderators have become a little ambitious towards closing some guitars.   SE questions in an attempt to &quot;avoid the problems on guitars. First off, I m not really sure what that means, so an elaboration on that would be nice--but in particular   if we are to enforce the driving logic behind closing questions like the one linked then all questions related to the specifics of some gear   (guitar electronics, amp design, effects design, pedalboard design, ad nauseum) should be closed as well. I could argue that circuit design on a Stratocaster is electrical   engineering, and consequently belongs on physics.SE, etcetera. The distinction between subject matter inside a broader topic is best handled by tags, not closings. It just so   happens that circuit design and a good bit of eMag are very heavily utilized subject matter when designing and describing amplifiers, electric guitars, and guitar effects.  It s a cross cutting aspect that in my opinion very much belongs here--every bit as much as questions related to repair, general maintenance, and technique."
I expect that we would suppress it as the site no longer exists.
" There will eventually be open moderator elections, and I m sure there will be some Guitars.SE users up for that. I also know that the merge was held up until pro-temp moderators  from music.SE were appointed... I m not sure what the time frame is for the open elections, but if it s going to be significantly far off, perhaps there is some wisdom to   appointing a transitional mod; Chernoff will have to chime in on that one."
"I don t see why not, provided you indicate the sources you ve already searched to save everyone s time including yours."
"Tags aren t created independent of questions.  If a set of good on-topic questions are about music videos, the tag will be added"
"The best way to get new users to our site is through word of mouth. Therefore, if we can reach people who have big mouths, more people will know who we are and why we re awesome.I d like to compile a list of music bloggers and journalists that you all think would be good to expose to this site.This list is not a who can I spam with press releases?type list. Ideally, these people would explore the site, use it a little, and if they like us, do some sort of review / publicity. And hopefully continue to be active users; we re looking for people who are experts in this area AND have some sort of following / klout in the community.I encourage each of you to promote the site whenever you can, to whomever you can - I will not provide a form letter because we at Stack Exchange believe in honest-to-goodness one-on-one interaction.;Although someone posted form letter over on Cooking.SE a long time ago.I think it would be great to have all these bloggers and journalists listed in one place that can be curated collectively and   continually.So...who do you think are good people to contact to help spread the word about music.SE and attract new users?"
"I m not sure there is a way to phrase the question you want to be on-topic, and still get you the answer you want. It sounds like what you want is an open-ended list of things, and those are almost always going to be out of scope on any SE site.I suspect some of the things you want could be found on the TV Tropes site, maybe start with the tropes list for the Bourne series and go from there? To be clear: I m absolutely not saying we aren t willing to help you figure out what questions are on-topic, or how to ask one that is likely to get an answer. But that question is probably not going to be exactly the same one you had in mind when you came here. The fact that you re asking for help phrasing your question means you recognize that the core of it is off-topic; the only way to fix that is to change the question.That new question may well be interesting and useful in its own right; if that s true then you re strongly encouraged to ask it. Just be aware -- it s probably not going to get the answers you were originally looking for"
"For something over a year, I ve been playing my guitar with an alternate tuning I invented, having found myself unable to get anywhere using conventional tuning since my fingers would always brush up against strings they re not supposed to.  Unlike some &quot;novice tunings&quot; which e.g. allow major chords to be played easily but make minor chords just about impossible, or which require ten-fret shifts when going between certain chords, this tuning allows all major, minor, and seventh chords to be played easily within a reasonable range (first nine frets, with the first finger confined to the first six)If anyone s written about or discussed this tuning before, I d like to read about it [hence the question Has anyone encountered G-D-d-f-g-b tuning (guitar)which I hope is on-topic as written].  If nobody s ever written about this tuning before, I m curious what the most appropriate way would be to solicit opinions about it.  I don t wish to be overly vain, but the fact that a novice (myself) could in 48 hours go from not being able to play anything, to being able to play Mermaid Song [Lloyd Weber] and Amazed [Lonestar] would suggest that the tuning does offer some unique advantages which   many people may find useful."
I m glad you linked to this question because the poster mentions Math.SE s reference-request tag.  It s interesting to me that they ve found a way to handle this issue there.
"I would like to ask a related question but I m still trying to learn where the appropriate place for a followup question is. To ask it as a new question would be somewhat redundant. To add it as a comment is not really a question. To add it as an answer is not really answering. (Although the best answers in life are often just better question -another long discussion that I ll avoid!) Ok that said..I have previously voiced my support in Meta for the scope as it currently stands and why it makes music.se unique as-is;I love this community in part because their is no limit in scope as regards genre, bringing me into contact with folks that don t happen to make the same music as. But, since there are no clear deliberations on this site as regards genre, it does bring in one little hiccup regarding lyrics. Lyrics are a greatly important performance-related issue for classical artists who make their art by recreating composer s songs. This also falls over into other genres, known there as singing covers. Focusing for a moment just on classical music, where specific musical performance choices hinge on key insights from text interpretation, what are we to make of questions in that domain here, and how do we keep the scope clear and consistent as the  site attracts more members?"
"I think that we need to add something about asking for resources to the list of off topic flag reasons. It isn t uncommon to see questions asking for drumless tracks, or for a  good sound editor. "
"Any tweak like this is going to take some development effort from StackExchange, and they haven t shown any indication of solving the jTab problems before we get out of beta.posts have already suggested some elegant solutions.I ll note that for single line monospace examples, you can also use backticks. At this point, I don t believe turning off jTab entirely would be a good idea -- we have lots of content that relies upon it, and every instance of it being applied incorrectly has one of the workarounds in place. It sucks, but the learning curve of our code blocks for new users   is not the thing that s keeping us from graduating"
"We have had a lot of sites throughout the history of Stack Exchange that have suffered problems dealing with recommendation questions. That is, questions which are intending to gather a collection of recommended items, from which the author selects their preferred answer out of. Here, this would be questions like the following: I enjoyed  Lucky Number Slevin , what movies out there are like it that I d enjoy? Are there any good Steampunk movies out there? However, these kinds of questions have very poor performance on the sites. This is because their functionality conflicts with the intent of our sites. Our goal is to have expert solutions that are identified by the depth of the knowledge of our users. The accepted answer system is founded on the principle that an answer serves as an  understood closure  to the question. quick notes . To summarize it concisely:They require extensive maintenance (which never happens for long) to be accurate The voting on such lists conflicts with the scope of voting on the site (people vote as if it was a poll, not based on quality)  No single item in the list can  conclude  the question, which conflicts with the nature of Q&amp;A. Many problems result in trying to reduce their scope, due to the subjectivity of how narrow criteria can be. So if any are allowed, generally all are allowed. Compounding on that, the ease and spread of itemized list recommendations gives a very poor image of the site as it does not showcase the expertise that many are looking for.Now, at the moment, there isn t necessarily an intent to invite or allow recommendation questions. Recommendations were in fact noted as off-topic during the definition phase, and there s no trace of them in the top voted on-topic questions. Nevertheless, I m writing this to hopefully get people in the mindset to understand why recommendations are hazardous, and consequently help setup a no-rec policy on the site  before  it opens to public beta. "
What would be the point of a movie QnA if you can t ask questions about the plot of a movie?
"I think that you take it on a case by case basis with the good rule of thumb being it s OK to tag series of movies. I can see Inception being a good tag because it is a movie that generates a lot of discussions, but would we really want a Snakes on a Plane tag? "
